<?xml version="1.0" encoding="UTF-8"?>
<!DOCTYPE softwarelist SYSTEM "softwarelist.dtd">
<!--
license:CC0-1.0
-->
<softwarelist name="mikrosha_cart" description="Mikrosha cartridges">

	<software name="micron">
		<description>BASIC-Micron, ED.Micron, Assembler</description>
		<year>19??</year>
		<publisher>&lt;unknown&gt;</publisher>
		<part name="cart" interface="mikrosha_cart">
			<dataarea name="rom" size="16384">
				<rom name="micron.rom" size="16384" crc="42ac7739" sha1="ca7ac6e0f38d54274db14d1dd4141722908b2d8b"/>
			</dataarea>
		</part>
	</software>

</softwarelist>
