<?xml version="1.0" encoding="UTF-8"?>
<!DOCTYPE softwarelist SYSTEM "softwarelist.dtd">
<!--
license:CC0-1.0

HP9825A/B/T option ROMs
Compiled by F.Ulivi with data from http://www.hpmuseum.net/
-->

<softwarelist name="hp9825_rom" description="HP 9825 Option ROMs">
	<software name="string_advprg">
		<description>String/Advanced programming ROM for 9825</description>
		<year>1976</year>
		<publisher>Hewlett-Packard</publisher>
		<info name="serial" value="98210A" />
		<sharedfeat name="compatibility" value="A" />
		<part name="rom" interface="hp9825_rom">
			<dataarea name="rom4000" size="0x800" width="16" endianness="big">
				<rom name="advanced.bin" size="0x800" crc="965b5e5a" sha1="ff44dd15f8fa4ca03dfd970ed8b200e8a071ec13" />
			</dataarea>
			<dataarea name="rom4c00" size="0x800" width="16" endianness="big">
				<rom name="strings.bin" size="0x800" crc="b5ca5da5" sha1="af13abb3c15836c566863c656e1659f7e6f96d04" />
			</dataarea>
		</part>
	</software>

	<software name="matrix">
		<description>Matrix ROM for 9825</description>
		<year>1976</year>
		<publisher>Hewlett-Packard</publisher>
		<info name="serial" value="98211A" />
		<part name="rom" interface="hp9825_rom">
			<dataarea name="rom3c00" size="0x800" width="16" endianness="big">
				<rom name="98211a.bin" size="0x800" crc="2cec553f" sha1="95c8d8becae6948accb342d23bc7072f0adb2c67" />
			</dataarea>
		</part>
	</software>

	<software name="plot9862_genio">
		<description>9862 Plotter/Gen I/O ROM for 9825</description>
		<year>1976</year>
		<publisher>Hewlett-Packard</publisher>
		<info name="serial" value="98212A" />
		<sharedfeat name="compatibility" value="A" />
		<part name="rom" interface="hp9825_rom">
			<dataarea name="rom3400" size="0x800" width="16" endianness="big">
				<rom name="general_io.bin" size="0x800" crc="b0386cb6" sha1="1b3a54edf54a5bdf92d1f7c6ec332fc00b037b49" />
			</dataarea>
			<dataarea name="rom3800" size="0x800" width="16" endianness="big">
				<rom name="plot9862.bin" size="0x800" crc="89db2f9c" sha1="6fff6637a450d230e6d9716d88cb54e592157416" />
			</dataarea>
		</part>
	</software>

	<software name="genio_ext">
		<description>General/extended I/O ROM for 9825</description>
		<year>1976</year>
		<publisher>Hewlett-Packard</publisher>
		<info name="serial" value="98213A"  />
		<sharedfeat name="compatibility" value="A"/>
		<part name="rom" interface="hp9825_rom">
			<dataarea name="rom3400" size="0x800" width="16" endianness="big">
				<rom name="general_io.bin" size="0x800" crc="b0386cb6" sha1="1b3a54edf54a5bdf92d1f7c6ec332fc00b037b49"/>
			</dataarea>
			<dataarea name="rom4400" size="0x1000" width="16" endianness="big">
				<rom name="extended_io.bin" size="0x1000" crc="1d67b773" sha1="4031bb00e49f7ea462aa6468f7e77b8589879a6a"/>
			</dataarea>
		</part>
	</software>

	<software name="genio_ext_plot62">
		<description>General/extended I/O/9862 plotter ROM for 9825</description>
		<year>1976</year>
		<publisher>Hewlett-Packard</publisher>
		<info name="serial" value="98214A" />
		<sharedfeat name="compatibility" value="A" />
		<part name="rom" interface="hp9825_rom">
			<dataarea name="rom3400" size="0x800" width="16" endianness="big">
				<rom name="general_io.bin" size="0x800" crc="b0386cb6" sha1="1b3a54edf54a5bdf92d1f7c6ec332fc00b037b49" />
			</dataarea>
			<dataarea name="rom3800" size="0x800" width="16" endianness="big">
				<rom name="plot9862.bin" size="0x800" crc="89db2f9c" sha1="6fff6637a450d230e6d9716d88cb54e592157416" />
			</dataarea>
			<dataarea name="rom4400" size="0x1000" width="16" endianness="big">
				<rom name="extended_io.bin" size="0x1000" crc="1d67b773" sha1="4031bb00e49f7ea462aa6468f7e77b8589879a6a" />
			</dataarea>
		</part>
	</software>

	<software name="plot_genio">
		<description>Plotter/Gen I/O ROM for 9825</description>
		<year>1976</year>
		<publisher>Hewlett-Packard</publisher>
		<info name="serial" value="98215A" />
		<sharedfeat name="compatibility" value="A" />
		<part name="rom" interface="hp9825_rom">
			<dataarea name="rom3400" size="0x800" width="16" endianness="big">
				<rom name="general_io.bin" size="0x800" crc="b0386cb6" sha1="1b3a54edf54a5bdf92d1f7c6ec332fc00b037b49" />
			</dataarea>
			<dataarea name="rom3800" size="0x800" width="16" endianness="big">
				<rom name="plot9872.bin" size="0x800" crc="0a9cb8db" sha1="d0d126fca108f2715e1e408cb31b09ba69385ac4" />
			</dataarea>
		</part>
	</software>

	<software name="genio_ext_plot">
		<description>General/extended I/O/plotter ROM for 9825</description>
		<year>1976</year>
		<publisher>Hewlett-Packard</publisher>
		<info name="serial" value="98216A" />
		<sharedfeat name="compatibility" value="A" />
		<part name="rom" interface="hp9825_rom">
			<dataarea name="rom3400" size="0x800" width="16" endianness="big">
				<rom name="general_io.bin" size="0x800" crc="b0386cb6" sha1="1b3a54edf54a5bdf92d1f7c6ec332fc00b037b49" />
			</dataarea>
			<dataarea name="rom3800" size="0x800" width="16" endianness="big">
				<rom name="plot9872.bin" size="0x800" crc="0a9cb8db" sha1="d0d126fca108f2715e1e408cb31b09ba69385ac4" />
			</dataarea>
			<dataarea name="rom4400" size="0x1000" width="16" endianness="big">
				<rom name="extended_io.bin" size="0x1000" crc="1d67b773" sha1="4031bb00e49f7ea462aa6468f7e77b8589879a6a" />
			</dataarea>
		</part>
	</software>

	<software name="mass">
		<description>9885 ROM for 9825</description>
		<year>1976</year>
		<publisher>Hewlett-Packard</publisher>
		<info name="serial" value="98217A" />
		<part name="rom" interface="hp9825_rom">
			<dataarea name="rom3000" size="0x800" width="16" endianness="big">
				<rom name="98217a.bin" size="0x800" crc="ee41c924" sha1="eac268523c09291a9939bc2dac201e4285185b51" />
			</dataarea>
		</part>
	</software>

	<software name="mass2">
		<description>9885/9895 ROM for 9825</description>
		<year>1980</year>
		<publisher>Hewlett-Packard</publisher>
		<info name="serial" value="98228A" />
		<sharedfeat name="compatibility" value="T" />
		<part name="rom" interface="hp9825_rom">
			<dataarea name="rom5c00" size="0x4000" width="16" endianness="big">
				<rom name="98228a.bin" size="0x4000" crc="31ce695e" sha1="b61273356c421102ff2bbd6aa7277200ee778097" />
			</dataarea>
		</part>
	</software>

	<software name="sssmass">
		<description>SSS mass storage ROM</description>
		<year>1984</year>
		<publisher>Structured Software Systems</publisher>
		<sharedfeat name="compatibility" value="T" />
		<part name="rom" interface="hp9825_rom">
			<dataarea name="rom5c00" size="0x4000" width="16" endianness="big">
				<rom name="sssmass.bin" size="0x4000" crc="95d36297" sha1="5e1777c894f6507a461c4a12f12ae5ac2c7a4385" />
			</dataarea>
		</part>
	</software>
</softwarelist>
